{
  "schemaVersion": "1.0.0",
  "package": "SunnyCove",
  "generated": "2026-07-21",
  "pathBase": "relativ zur Paket-Wurzel (SunnyCoveAssets/)",
  "totalAssets": 173,
  "byCategory": {
    "merge_item": 40,
    "generator_state": 20,
    "board_token": 11,
    "board_tile": 9,
    "character_pose": 24,
    "ui": 52,
    "scene": 3,
    "scene_element": 9,
    "appstore": 5
  },
  "assets": [
    {
      "id": "chain1_beach_1_shell_shard",
      "path": "items/chain1_beach_1_shell_shard.svg",
      "category": "merge_item",
      "format": "svg",
      "width": 512,
      "height": 512,
      "transparent": true,
      "purpose": "Merge-Objekt (Board-Spielstein)",
      "appName": "Muschelsplitter"
    },
    {
      "id": "chain1_beach_2_small_shell",
      "path": "items/chain1_beach_2_small_shell.svg",
      "category": "merge_item",
      "format": "svg",
      "width": 512,
      "height": 512,
      "transparent": true,
      "purpose": "Merge-Objekt (Board-Spielstein)",
      "appName": "Kleine Muschel"
    },
    {
      "id": "chain1_beach_3_shell_trio",
      "path": "items/chain1_beach_3_shell_trio.svg",
      "category": "merge_item",
      "format": "svg",
      "width": 512,
      "height": 512,
      "transparent": true,
      "purpose": "Merge-Objekt (Board-Spielstein)",
      "appName": "Bunte Muscheln"
    },
    {
      "id": "chain1_beach_4_shell_collection",
      "path": "items/chain1_beach_4_shell_collection.svg",
      "category": "merge_item",
      "format": "svg",
      "width": 512,
      "height": 512,
      "transparent": true,
      "purpose": "Merge-Objekt (Board-Spielstein)",
      "appName": "Muschelsammlung"
    },
    {
      "id": "chain1_beach_5_pearl_shell",
      "path": "items/chain1_beach_5_pearl_shell.svg",
      "category": "merge_item",
      "format": "svg",
      "width": 512,
      "height": 512,
      "transparent": true,
      "purpose": "Merge-Objekt (Board-Spielstein)",
      "appName": "Perlenmuschel"
    },
    {
      "id": "chain1_beach_6_pearl_necklace",
      "path": "items/chain1_beach_6_pearl_necklace.svg",
      "category": "merge_item",
      "format": "svg",
      "width": 512,
      "height": 512,
      "transparent": true,
      "purpose": "Merge-Objekt (Board-Spielstein)",
      "appName": "Perlenkette"
    },
    {
      "id": "chain1_beach_7_jewelry_box",
      "path": "items/chain1_beach_7_jewelry_box.svg",
      "category": "merge_item",
      "format": "svg",
      "width": 512,
      "height": 512,
      "transparent": true,
      "purpose": "Merge-Objekt (Board-Spielstein)",
      "appName": "Schmuckschatulle"
    },
    {
      "id": "chain1_beach_8_treasure_crown",
      "path": "items/chain1_beach_8_treasure_crown.svg",
      "category": "merge_item",
      "format": "svg",
      "width": 512,
      "height": 512,
      "transparent": true,
      "purpose": "Merge-Objekt (Board-Spielstein)",
      "appName": "Meeresschatzkrone"
    },
    {
      "id": "chain2_bar_1_lime_slice",
      "path": "items/chain2_bar_1_lime_slice.svg",
      "category": "merge_item",
      "format": "svg",
      "width": 512,
      "height": 512,
      "transparent": true,
      "purpose": "Merge-Objekt (Board-Spielstein)",
      "appName": "Limettenscheibe"
    },
    {
      "id": "chain2_bar_2_limes",
      "path": "items/chain2_bar_2_limes.svg",
      "category": "merge_item",
      "format": "svg",
      "width": 512,
      "height": 512,
      "transparent": true,
      "purpose": "Merge-Objekt (Board-Spielstein)",
      "appName": "Limetten"
    },
    {
      "id": "chain2_bar_3_juice_glass",
      "path": "items/chain2_bar_3_juice_glass.svg",
      "category": "merge_item",
      "format": "svg",
      "width": 512,
      "height": 512,
      "transparent": true,
      "purpose": "Merge-Objekt (Board-Spielstein)",
      "appName": "Saftglas"
    },
    {
      "id": "chain2_bar_4_lemonade",
      "path": "items/chain2_bar_4_lemonade.svg",
      "category": "merge_item",
      "format": "svg",
      "width": 512,
      "height": 512,
      "transparent": true,
      "purpose": "Merge-Objekt (Board-Spielstein)",
      "appName": "Limonade"
    },
    {
      "id": "chain2_bar_5_coconut_drink",
      "path": "items/chain2_bar_5_coconut_drink.svg",
      "category": "merge_item",
      "format": "svg",
      "width": 512,
      "height": 512,
      "transparent": true,
      "purpose": "Merge-Objekt (Board-Spielstein)",
      "appName": "Kokosdrink"
    },
    {
      "id": "chain2_bar_6_tropical_cocktail",
      "path": "items/chain2_bar_6_tropical_cocktail.svg",
      "category": "merge_item",
      "format": "svg",
      "width": 512,
      "height": 512,
      "transparent": true,
      "purpose": "Merge-Objekt (Board-Spielstein)",
      "appName": "Tropischer Cocktail"
    },
    {
      "id": "chain2_bar_7_cocktail_tray",
      "path": "items/chain2_bar_7_cocktail_tray.svg",
      "category": "merge_item",
      "format": "svg",
      "width": 512,
      "height": 512,
      "transparent": true,
      "purpose": "Merge-Objekt (Board-Spielstein)",
      "appName": "Cocktailtablett"
    },
    {
      "id": "chain2_bar_8_luxury_bar_set",
      "path": "items/chain2_bar_8_luxury_bar_set.svg",
      "category": "merge_item",
      "format": "svg",
      "width": 512,
      "height": 512,
      "transparent": true,
      "purpose": "Merge-Objekt (Board-Spielstein)",
      "appName": "Strandbar-Gedeck"
    },
    {
      "id": "chain3_surf_1_wax",
      "path": "items/chain3_surf_1_wax.svg",
      "category": "merge_item",
      "format": "svg",
      "width": 512,
      "height": 512,
      "transparent": true,
      "purpose": "Merge-Objekt (Board-Spielstein)",
      "appName": "Surf-Wachs"
    },
    {
      "id": "chain3_surf_2_wax_comb",
      "path": "items/chain3_surf_2_wax_comb.svg",
      "category": "merge_item",
      "format": "svg",
      "width": 512,
      "height": 512,
      "transparent": true,
      "purpose": "Merge-Objekt (Board-Spielstein)",
      "appName": "Wachs & Kamm"
    },
    {
      "id": "chain3_surf_3_fin",
      "path": "items/chain3_surf_3_fin.svg",
      "category": "merge_item",
      "format": "svg",
      "width": 512,
      "height": 512,
      "transparent": true,
      "purpose": "Merge-Objekt (Board-Spielstein)",
      "appName": "Finne"
    },
    {
      "id": "chain3_surf_4_bodyboard",
      "path": "items/chain3_surf_4_bodyboard.svg",
      "category": "merge_item",
      "format": "svg",
      "width": 512,
      "height": 512,
      "transparent": true,
      "purpose": "Merge-Objekt (Board-Spielstein)",
      "appName": "Bodyboard"
    },
    {
      "id": "chain3_surf_5_simple_board",
      "path": "items/chain3_surf_5_simple_board.svg",
      "category": "merge_item",
      "format": "svg",
      "width": 512,
      "height": 512,
      "transparent": true,
      "purpose": "Merge-Objekt (Board-Spielstein)",
      "appName": "Einfaches Surfboard"
    },
    {
      "id": "chain3_surf_6_pro_board",
      "path": "items/chain3_surf_6_pro_board.svg",
      "category": "merge_item",
      "format": "svg",
      "width": 512,
      "height": 512,
      "transparent": true,
      "purpose": "Merge-Objekt (Board-Spielstein)",
      "appName": "Profi-Surfboard"
    },
    {
      "id": "chain3_surf_7_surf_gear",
      "path": "items/chain3_surf_7_surf_gear.svg",
      "category": "merge_item",
      "format": "svg",
      "width": 512,
      "height": 512,
      "transparent": true,
      "purpose": "Merge-Objekt (Board-Spielstein)",
      "appName": "Surf-Ausrüstung"
    },
    {
      "id": "chain3_surf_8_legendary_set",
      "path": "items/chain3_surf_8_legendary_set.svg",
      "category": "merge_item",
      "format": "svg",
      "width": 512,
      "height": 512,
      "transparent": true,
      "purpose": "Merge-Objekt (Board-Spielstein)",
      "appName": "Legendäres Sunny-Cove-Set"
    },
    {
      "id": "chain4_tool_1_screw",
      "path": "items/chain4_tool_1_screw.svg",
      "category": "merge_item",
      "format": "svg",
      "width": 512,
      "height": 512,
      "transparent": true,
      "purpose": "Merge-Objekt (Board-Spielstein)",
      "appName": "Schraube"
    },
    {
      "id": "chain4_tool_2_screw_pack",
      "path": "items/chain4_tool_2_screw_pack.svg",
      "category": "merge_item",
      "format": "svg",
      "width": 512,
      "height": 512,
      "transparent": true,
      "purpose": "Merge-Objekt (Board-Spielstein)",
      "appName": "Schraubenpäckchen"
    },
    {
      "id": "chain4_tool_3_screwdriver",
      "path": "items/chain4_tool_3_screwdriver.svg",
      "category": "merge_item",
      "format": "svg",
      "width": 512,
      "height": 512,
      "transparent": true,
      "purpose": "Merge-Objekt (Board-Spielstein)",
      "appName": "Schraubendreher"
    },
    {
      "id": "chain4_tool_4_hammer",
      "path": "items/chain4_tool_4_hammer.svg",
      "category": "merge_item",
      "format": "svg",
      "width": 512,
      "height": 512,
      "transparent": true,
      "purpose": "Merge-Objekt (Board-Spielstein)",
      "appName": "Hammer"
    },
    {
      "id": "chain4_tool_5_tool_bag",
      "path": "items/chain4_tool_5_tool_bag.svg",
      "category": "merge_item",
      "format": "svg",
      "width": 512,
      "height": 512,
      "transparent": true,
      "purpose": "Merge-Objekt (Board-Spielstein)",
      "appName": "Werkzeugtasche"
    },
    {
      "id": "chain4_tool_6_toolbox",
      "path": "items/chain4_tool_6_toolbox.svg",
      "category": "merge_item",
      "format": "svg",
      "width": 512,
      "height": 512,
      "transparent": true,
      "purpose": "Merge-Objekt (Board-Spielstein)",
      "appName": "Werkzeugkasten"
    },
    {
      "id": "chain4_tool_7_workbench",
      "path": "items/chain4_tool_7_workbench.svg",
      "category": "merge_item",
      "format": "svg",
      "width": 512,
      "height": 512,